	dataset	source	language	text	task1
812	MeTwo	Twitter	es	"cito a todos para que todos los que están debatiendo tengan todas las visiones.
Y te equivocás mucho pensando que odio a las mujeres. Pero como lo afirmaste en lugar de preguntarme ni me molesté en responderte. https://t.co/slGrg4JpRs"	non-sexist
813	MeTwo	Twitter	es	@ramirezmascaro Joder! La madre que te parió se quedó a gustoooo!!!! No solo espero que se encienda la luz para mirar antes de entrar a la cocina por si encuentro arañas/cucarachas/arañazas...sino que ahora tengo que darle con un trapo al interruptor antes de encender...me cago en toooo!	non-sexist
814	MeTwo	Twitter	es	"Macris mira, la marimacho llegó a la fusión y tu le cagaste el juego a tu equipo. 
#DesafioSuperHumanos"	non-sexist
815	MeTwo	Twitter	es	@melmuertos Mujer tenías que ser JAJAJAJAJA🤦🏻‍♂️	sexist
816	MeTwo	Twitter	es	Quédate cerquita de las personas que te dieron luz en tus días más oscuros.	non-sexist
817	MeTwo	Twitter	es	"Rió, negando con la cabeza.

— Por favor, sabes que no es así—y para reafirmar sus palabras, dedicó una caricia más sobre el cabello ajeno—... Sólo es mi manera de demostrarte afecto. Te veo como una mujer, como una muy atractiva."	non-sexist
818	MeTwo	Twitter	es	No entiendo como una mujer que ha abortado puede estar en contra de la legalización del aborto ¿? 🤦🏽‍♀️	non-sexist
819	MeTwo	Twitter	es	"Mi madre se comporta como una niña de 5 años
Solo con decir que me ha bloqueado en whatsapp"	non-sexist
820	MeTwo	Twitter	es	"@Polerizado Tu amiga Candela es la que ha empezado todo esto y a contestar como una niña pequeña.

Yo solo he respondido en consecuencia.

¿Ella ha insistido en seguir citandome? Pues yo le sigo el juego. https://t.co/BvGg3yywYq"	non-sexist
821	MeTwo	Twitter	es	Comparsa Juana la Loca del gran Tino Tovar, 2011, una maravilla. https://t.co/Z9MJjvzCi3	non-sexist
822	MeTwo	Twitter	es	ola soy la loca del bebito y estás viendo disney channel	non-sexist
823	MeTwo	Twitter	es	@NataliaDeLaV Así como es hombre o mujer así es rico y pobre que dice todo Es como decir menos hombre para ser mujer o menos mujer para ser hombre No hay que inventar otro idioma	non-sexist
824	MeTwo	Twitter	es	@sandra_827825 @iescolar El quinto mejor país para ser mujer. Es decente y estoy orgulloso de ello, aunque siempre es mejorable.	non-sexist
825	MeTwo	Twitter	es	Empece el gim y despues me comi un lomito jajajaj no sirvo para ser chica fit	non-sexist
826	MeTwo	Twitter	es	@Gabova8 @afsalinasv Esa gente mojigata de Bogotá 👀👀👀👀👀👀 @Gabova8	non-sexist
827	MeTwo	Twitter	es	@andreamvo @Foro_TV @giselle_zm @jcdiazmurrieta @VicenteAmador @luzmadelamora No, las mujeres no deberían cuidarse más que los hombres, los hombres deben respetar más a las mujeres, nadie debe tener miedo a salir a la calle	non-sexist
828	MeTwo	Twitter	es	"""La  negativa a q el aborto sea legal, lleva implícito el elemento castigo: si follaste, pare.
Porque las mujeres, no deberían follar tan alegremente, ni que fueran  hombres"" https://t.co/w3StTGiHhM"	sexist
829	MeTwo	Twitter	es	"@TanuuAredes Pues quédate en tu casa si nos odias, exagerada.
Es más fácil decir que odias a todo un colectivo antes e pararte a pensar y hablar sin el calentón de la rabia.
Por cierto,odio a las mujeres exageradas :)"	non-sexist
830	MeTwo	Twitter	es	"Acá explica el odio a las mujeres. Lo nefasto que es.
Un ejemplo el Edu... https://t.co/orIZK8oG9z"	non-sexist
831	MeTwo	Twitter	es	“Las mujeres de hoy en día tienen mucha babilla, te paso por encima y no le cogiste la tablilla” - procer boricua	sexist
832	MeTwo	Twitter	es	"Yo no soy una lagartona..
A uwu la puede cazar pero a mí no.
Tú sabrás quién eres payaso"	non-sexist
833	MeTwo	Twitter	es	Tu wacha es alta lagartona. 🎶🎶🎶🎶	non-sexist
834	MeTwo	Twitter	es	Como cuando ya van a cerrar el antro, prenden las luces de golpe y te encuentras abrazado de una lagartona... https://t.co/7kmVMovJ4y	sexist
835	MeTwo	Twitter	es	"NO SOY PERRA NI SOY GATA, SOY DIVAZA Y ESO A TI TE MATA. 
@ LAGARTONA ;)"	non-sexist
836	MeTwo	Twitter	es	VAMOS A DARLE EL LEVANTON A LA LAGARTONA ESA	sexist
837	MeTwo	Twitter	es	@AgustinLaje @AvanzadaRep @rialjorge Aqui un libro de Evita jablando de las feministas: https://t.co/612biYJ9k6	non-sexist
838	MeTwo	Twitter	es	@YosStoP No!, pareces una puta foca con retraso mental.	non-sexist
839	MeTwo	Twitter	es	@rhm1947 Pareces una puta chavista	sexist
840	MeTwo	Twitter	es	“Pareces una puta con ese pantalón” - Mi hermano de 13 cuando me vio con un pantalón de cuero	sexist
841	MeTwo	Twitter	es	@Vaneruuuiz Pues en realidad eres alta para ser chica, yo es q mido 190	sexist
842	MeTwo	Twitter	es	Debería estar más activo, crearme otra cuenta para ser chica, pero no estoy haciendo ni la mitad de las cosas. No sé si se deba a la fiebre o a la flojera que cargo encima en este día.	non-sexist
843	MeTwo	Twitter	es	@badbunnybeibe Para ser chica no está mal	sexist
844	MeTwo	Twitter	es	"""Que si expresas tus emociones eres histérica y si no las expresas estás malcomida. Que si defiendes a otras mujeres eres feminazi porque lo de Dios es devorarlas a críticas. Que si tiras fácil eres muy perra y si no eres mojigata, que si no te arreglas eres lesbiana..."	non-sexist
845	MeTwo	Twitter	es	@arlettecontrers @noticias_tvperu @Latina_Noticias @atvmasnoticias @exitosape @RPPActualidad @canalN_ @elcomercio_peru @larepublica_pe Las mujeres de hoy en día, son malas madres en su mayoría ,vagas y quieren pena de muerte,pero cuando maltratan ,torturan y hacen lesiones a sus hijos,no dicen nada.solo son feminazis https://t.co/tZy8wgqFwS	sexist
846	MeTwo	Twitter	es	"@SaulEstrada777 @gontxo2012 @Septumboy El término ""feminazi"" no existe. Los nazis ya no existen, y creeme que no he participado en ningún tipo de holocausto como para que me consideres una. Y además, qué tiene que ver Wismichu? Qué te hace pensar que yo lo apoyo o que tengo un mínimo de interés en él?"	non-sexist
847	MeTwo	Twitter	es	Ahora nos salió muy delicada de piel, la nefasta politiquilla del PRI, que se cambió a Morena con la ambición de ganar, pero sin apoyo de nadie. (perdió). Le reitero a esta señora feminazi, @EuniceArias que mi lucha es contra todos los vividores d la política, no solo contra ella https://t.co/JLuKTht5TO	sexist
848	MeTwo	Twitter	es	Fui a la cocina a buscar un cenicero y me encontré con que los gatos no solo habían prendido una hornalla sino que habían tirado un cable arriba 🙃	non-sexist
849	MeTwo	Twitter	es	"@pgvelarde39 @hreyesaguinaga @MashiRafael Anda a fregar a otro desubicado..
Tú ""patria"" está pagando los platos rotos de 10 años de
R. O. B. O
A. T. R. A. C. O.
D. E. S. P. I. L. F. A. R. R. O
S. O. B. R. E. P. R. E. C. I. O
N. A. R. C. O.
M. A. F. I. A
tus colegas de atraca país se llevaron harto 💵💶💲
RATAS!"	non-sexist
850	MeTwo	Twitter	es	Por favor, antes de iros a compartir piso, aprended a fregar los malditos platos.	non-sexist
851	MeTwo	Twitter	es	Y en tus días malos, te voy a querer todavía más.	non-sexist
852	MeTwo	Twitter	es	@AngeldebritoOk Es que no se parecem nada!! Ni un poquito,   son dos bellezas totalmente opuestas, Susana era un mujeron, alta corpulenta muy sexy, y esta chica es bonita pero menudita como una niña angelical ,  nada que ver	non-sexist
853	MeTwo	Twitter	es	Odio que me traten aún como una niña pequeña.	non-sexist
854	MeTwo	Twitter	es	@ErneX Loca del coño	non-sexist
855	MeTwo	Twitter	es	¡Arriba las manos! Los miembros de la comisaría más loca del país, @comisaria13, ya están con nosotros 😱👮 ¿A quién crees que deberían detenerle? 🤔😅 #MuchoGustoPy #ExperienciasReales https://t.co/UE3gHQVHHc	non-sexist
856	MeTwo	Twitter	es	De pronto tuve el muy extraño deseo de crearme una cuenta para ser chica, basta.	non-sexist
857	MeTwo	Twitter	es	Para ser chica cool de Instagram necesitas tener unos lentes de sol de forma extraña y fea.	non-sexist
858	MeTwo	Twitter	es	mmmm mucho feminismo mucho feminismo pero bardeamos por como se viste una jaja	sexist
859	MeTwo	Twitter	es	@TefCarvajal O cuando dicen :  tenía que ser una mujer al volante”como lo detesto.	sexist
860	MeTwo	Twitter	es	"Ventajas de salir con un gamer:
-Odio a las mujeres y a las minorias
-Me creo superior por jugar a X juegos
-Me follo a tu madre via wifi
- Soy Platino en el LoL

Os podría poner mas ventajas pero no quiero que se me llenen los MD de proposiciones de matrimonio"	sexist
861	MeTwo	Twitter	es	"@RightTerminator @sunshinexmiley @ManzanaAntiFem No, niño. Desde el punto legal, jurisprudencia, leyes y por supuesto lo social, estás diciendo una burrada inmensa.
No vale la pena ni empezar a discutir, viendo tu nivel de conocimiento. Te dejo tranqui con tu odio a las mujeres. Qué triste vivir así."	non-sexist
862	MeTwo	Twitter	es	ROBAMARIDOS LAGARTONA INFELIZ	sexist
863	MeTwo	Twitter	es	Cuando usan la palabra “feminazi” https://t.co/NvOj9eLP4D	non-sexist
864	MeTwo	Twitter	es	Si a una #feminazi le dices eso, te tacha de retrograda.... Pero como lo dijo una Feminista que luchaba por igualdad peor, ni la conocen!! Total que se confirma todos los dias, solo es una moda...!! https://t.co/rqekNrsNq4	sexist
865	MeTwo	Twitter	es	Fui a buscar una banana a la cocina y terminé comiendo banana con dulce de leche👍	non-sexist
866	MeTwo	Twitter	es	ENTE ERES PATÉTICO Y PENOSO Q NO PUEDES ESTAR CON UNA MUJER DE VERDAD Y TIENES QUE ESTAR CON UNA NIÑATA INAGUANTABLE GORDA DE MIERDA	non-sexist
867	MeTwo	Twitter	es	♀🏆 El primer galardón que destaca la presencia de la MUJER EN TELEVISIÓN premia la sección 'MUJER TENÍAS QUE SER' (@El_Intermedio) de @CARMENAGUILERAM y @sandrasabates11 #FesTVal https://t.co/GjiTIFUTyE	non-sexist
868	MeTwo	Twitter	es	"@NicoBucci3 y con un perejil que termino en su útero y no con el misoprostol que las feministas dan en vez de hacer mea culpa de que la penalización y el ""amor"" de salvemos las dos vidas asesina a las mujeres y expone a otras más a riesgos."	non-sexist
869	MeTwo	Twitter	es	Me bloqueó la kirchnerista menopáusica @mabaires por decirle que las pibas pobres nos enteramos del misoprostol gracias a las feministas que está defenestrando y no a CFK ¿Se puede ser tan soreta?	non-sexist
870	MeTwo	Twitter	es	Quiero estar con vos. No un rato, no un día. Quiero estar con vos en tus días buenos y también en los peores. Estar con vos, así de simple.	non-sexist
871	MeTwo	Twitter	es	Balvin dejó la pura zorra	non-sexist
872	MeTwo	Twitter	es	"El síndrome post aborto es un mito en mi opinión. Esta ligado al estrés post traumático y digo yo ¿como una mujer no va a sentir culpa, ansiedad, depresión entre otros síntomas que dice este síndrome si repiten el mismo dogma ""el aborto es asesinato?"	non-sexist
873	MeTwo	Twitter	es	Como una mujer que ama las faldas y aprecia sobremanera los kilts, apruebo esto. https://t.co/2HrS7PNP3w	non-sexist
874	MeTwo	Twitter	es	Suerte que no lo pago con la enfermera de triaje. La loca del coño se tomó mal su clasificación 😡 https://t.co/G4FhawABnx	non-sexist
875	MeTwo	Twitter	es	Una loca del coño ha incendiado las urgencias del hospital de la Candelaria ha acercado un mechero a una de las bombonas de oxígeno porque tardaban en atenderla	non-sexist
876	MeTwo	Twitter	es	Tengo la sensación de que toda la movida de la TERF @dextructora contra @gladiadora_r viene motivada por la rabia de la primera a que expusiesemos el tweet que borro en el que decía que para ser mujer tenías que depilarte...	non-sexist
877	MeTwo	Twitter	es	"29. ""Tienes una letra horrible para ser chica"" DISCULPA SEÑOR DIPLOMADO EN CALIGRAFÍA, no es mi culpa hacer esa letra y si no la entiendes te vas a la mierda. 
La letra bonita se tarda más y encima si tienes letra fea en la cartulina es un trabajo menos que hacer
Letra fea wins"	sexist
878	MeTwo	Twitter	es	"mucho feminismo pero si sos blanca de clase media y encima ""terf"" te deseo la  muerte. AH NO disculpa, una ""metáfora"" https://t.co/Pti2eirx0V"	sexist
879	MeTwo	Twitter	es	😂😂😂😂😂 tenía que ser mujer al “volante” Jajajaja https://t.co/0n2EIa5pfj	sexist
880	MeTwo	Twitter	es	@SantiagoAdrian_ Las mujeres de hoy en día que no saben cuidar de príncipes como nosotros	sexist
881	MeTwo	Twitter	es	Me ha gustado un vídeo de @YouTube (https://t.co/igRjfFgi65 - LAS MUJERES DE HOY EN DIA - YoungSwagon #LasOcurrenciasDeYoungSwag).	non-sexist
882	MeTwo	Twitter	es	@MiguelAngValdes @Alejand64944137 @CiberPolicia @TwitterSeguro Por más lambiscon que seas no te la vas a tirar ya que dudo que sea mujer, solo es un Bots 😂🤢 Que se largue a la cocina y si no quiere recibir insultos entonces que no tire basura y quiera recibir dulces la pendeja.	sexist
883	MeTwo	Twitter	es	Tiene pinta de caballón marimacho. https://t.co/QgZzoC4blr	non-sexist
884	MeTwo	Twitter	es	"@ttanyto https://t.co/4GRoGCZAf7
 Ahí te adjunto la verdad.
Yo me alegro que hagas eso.  Mi tuit sabes bien que va por esas personas hipócritas que hay... me parece una aberración que gane 18.000 a la semana una niñata sin estudios.."	non-sexist
885	MeTwo	Twitter	es	Quiero estar con vos. No un rato, no un día. Quiero estar con vos en tus días buenos y también en los peores. Estar con vos, así de simple.	non-sexist
886	MeTwo	Twitter	es	La zorra se me echó a perder la cámara del celular y llevo 2 días de mi viaje pre intercambio 🙃	non-sexist
887	MeTwo	Twitter	es	Le buscáis las tres patas al gato a TODO macho. Acabo de ver una foto en la que alguien decía 'la mejor creación que puede hacer una mujer' o algo así junto con fotos de bebés. Y le cita alguien poniendo cosas como 'una mujer puede crear obras de arte, tal...' Tio, crear una	non-sexist
888	MeTwo	Twitter	es	Me apena que las mismas mujeres no se ponen de acuerdo para defender sus derechos. ¿Cómo una mujer condena a otra que no quiere morir?	non-sexist
889	MeTwo	Twitter	es	"@maxikron No no! No soy amante de esa señora, podría ser mi abuela.
En todo caso pareciera ser que es tu ex. Hablas como una mujer despechada. Tanto odio tenes que no podes justificar absolutamente nada de lo que expresas."	non-sexist
890	MeTwo	Twitter	es	Me siento como una mujer arriesgada😂	non-sexist
891	MeTwo	Twitter	es	"Su cara de felicidad. Por favor. 
""En el escenario juega como una niña de 5 años""
Es que el escenario es como su casa 😍 https://t.co/S03IWlFtAG"	non-sexist
892	MeTwo	Twitter	es	Mi suerte en el amor es tan nula que me gustaría que alguien de mis crushes me dijera “es que pareces una puta loca cuando me hablas” para saber porque nadie me ha hecho caso nunca	non-sexist
893	MeTwo	Twitter	es	@olgadancer18 Estás loca del coño pero🖤	non-sexist
894	MeTwo	Twitter	es	"🎉🎶🔝😎🔥☀️🏝
Este sábado 18 @universiclub llega a takosykopas para vivir una noche llena de locura
———
-100% música comercial
-Concursos sobre el escenario
-La animación más loca del… https://t.co/gRKAblTNO3"	non-sexist
895	MeTwo	Twitter	es	El casting para ser chica Bond se multiplica. https://t.co/Ibzhw8lfos	non-sexist
896	MeTwo	Twitter	es	La neta si soy bien mujer al volante 🤷🏻‍♀️	non-sexist
897	MeTwo	Twitter	es	Iba todo tranquilino repartiendo lechuga fresca, cuando una mujer al volante me interceptó para venderme ropa. https://t.co/F4I8CmInfZ	non-sexist
898	MeTwo	Twitter	es	"@Peepaa6 @cdohrlancero @MashiRafael @AniMeGalarza @Martinminguchi @adrygdlt @shababaty @andrespaezec @FFAAECUADOR @CarlosVerareal @HernanUlloa @VillavicencioFV @economista33 Si le dices meco por decir eso imaginate a q nivel de mariconada estaba un tipo q le tenía odio a las mujeres y les decía gordas horrorosas o tratarlas de esa gatita q x tener ojos de color...
Lagaña en ojo ajeno inca mijita 🤣🤣🤣🤣🤣🤣🤣"	non-sexist
899	MeTwo	Twitter	es	@ginesggarcia Su religión es el odio a las mujeres.	non-sexist
900	MeTwo	Twitter	es	No se por que pero las mujeres de hoy en día se visten como mujeres mayores , y no entendemos por que? por que se visten de viejas?	non-sexist
901	MeTwo	Twitter	es	Carvajal llora nenaza JAJAJA	sexist
902	MeTwo	Twitter	es	"@Darekoto Ve a la cocina, pregunta por el responsable, siguele a su casa, déjale una mierda en un plato delante de su puerta y ponle una nota que diga: ""esto es lo que sirves, cómetelo"".
Y luego le apuñalas."	non-sexist
903	MeTwo	Twitter	es	odio que me entre hambre a las 12 de la noche porque no quiero bajar a la cocina a coger algo	non-sexist
904	MeTwo	Twitter	es	@ByDaniPro03 @NakoWhiteDeity cuéntame, cómo los hombres analizan su masculinidad? deconstruyen sus estereotipos? cuestionan sus privilegios? no me queda claro, lo único que veo es que se burlan de las feministas (así como tu)	non-sexist
905	MeTwo	Twitter	es	"@Irecersan @FrayJosepho Si @lrecersan fuera un hombre y hablara así de una mujer y no de @perezreverte, las feministas ya estarían denunciándola/le por tratar a @perezreverte como un objeto de deseo 

Menos mal que a los hombres nos queda l'insupprtable légèreté de l'être 😂"	sexist
906	MeTwo	Twitter	es	@SantiCruz Bueno así como una niña puede sentirla tan dentro, bueno así es con tu música, .. ves? Así de claro así de preciso así de sentido.	sexist
907	MeTwo	Twitter	es	"“Estas loca del doble coño.”

Nueva expresión válida por @JRhodesPianist"	non-sexist
908	MeTwo	Twitter	es	@DianaPatane @mariuvidal Y encima está muy aliviada. Por suerte las mujeres que deciden abortar en su provincia se mueren nomás, sin generarle ningún costo a su gobierno. Es única en serio!! Pedazo de energúmena mojigata!!	non-sexist
909	MeTwo	Twitter	es	"Del 21 al 23 de Se(p)tiembre: La Mojigata en Argentina

21 de Septiembre 21hs (Mar del Plata)
La Mojigata y la Miseria
Teatro Auditorium sala Astor… https://t.co/6aDI3dNYm4"	non-sexist
910	MeTwo	Twitter	es	@SCJN Pinche vieja lagartona , tomenle el nombre y cuando ocupe un amparo denle puro chile por ojarasca @elanafre @angulartaller	sexist
911	MeTwo	Twitter	es	Me encanta la bio de @oscarbb_, porque detalla perfecto la lagartona cementera que es.	sexist
912	MeTwo	Twitter	es	"He llegado a la conclusión de que siendo un poco egoista, todo este movimiento ""feminista radical / feminazi / hembrista / como quiera llamarlo cada uno"" me favorece y todo... +"	sexist
913	MeTwo	Twitter	es	@alonso_dm @fray_fanatic Una tarada feminazi y sectaria que si no da que hablar, revienta	sexist
914	MeTwo	Twitter	es	si, sonas troskoanarkokirchnerista y feminazi además https://t.co/WtIt9RnnXS	sexist
915	MeTwo	Twitter	es	A toda hostia a la cocina a por algo de comer https://t.co/qJSEsS0gUx	non-sexist
916	MeTwo	Twitter	es	"Yo: Ma', me quiero cortar el pelo super corto

Mi madre: ¡ni de coña que luego te vas a arrepentir! Además ¿por qué te vas a cortar el pelo? Que luego vas a parecer una marimacho con la forma en la que te vistes. Definitivamente NO

Y luego dicen que mi madre es genial... https://t.co/yYs8ko6EYz"	non-sexist
917	MeTwo	Twitter	es	@LynaFails que inútil eres niñata	non-sexist
918	MeTwo	Twitter	es	Chega un punto no que unha non cala ante señoros que gritan “mujer tenías que ser”. Porque recordade: caladas non estamos máis guapas.	non-sexist
919	MeTwo	Twitter	es	en tus días malos,te voy a querer todavía más	non-sexist
920	MeTwo	Twitter	es	"""La envidia es como una mujer roncando...""
-Es mejor despertarla que sentirla-
😂🙌🏼

By. @Dantegebel3 
#Monologo #LaEnvidia #DanteNigthShow"	sexist
921	MeTwo	Twitter	es	@xTheNomad « tormenta de nieve y crear ilusiones duraderas. Aun cuando ella fuera una mujer que podía fundirse en las sombras y plantar cara a las batallas, en verdad se sentía como una niña inexperta a su lado. - Claro... por supuesto... - Asintió en »	non-sexist
922	MeTwo	Twitter	es	"Como me rompe las pelotas esos comentarios de tipico machito nefasto:""sos una señorita no podes hacer esas cosas"" ""tenes que lavar los platoses tu responsabilidad "" ""como te vas a poner eso? pareces una puta""."	sexist
923	MeTwo	Twitter	es	"Que molesto que son los vagos que le dicen a su novia ""ponete algo más suelto, que se te nota todo y pareces una puta"" bue flaco se pueden vestir como ellas quieran, se tienen que sentir cómodas ellas no vos"	sexist
924	MeTwo	Twitter	es	Mi gran duda es ¿hay que tener buen culo para ser chica del clima/noticiero, o ser chica del clima/noticiero para tener buen culo?	sexist
925	MeTwo	Twitter	es	"El día de hoy me di cuenta lo mucho que me miento día a día diciendo ""ya ahora si mañana voy al gym"" soy demasiado gorda como para ser chica fitness."	non-sexist
926	MeTwo	Twitter	es	@xoxdalia Por eso las mujeres no deberían de manejar lo único que hacen es andar provocando a los hombres ay y encargo no es todo nuestra culpa ok 😉 😉	sexist
927	MeTwo	Twitter	es	Las mujeres de hoy en dia que !!!!! jumm, siempre esperando a que les den algo, o que se las coman	sexist
928	MeTwo	Twitter	es	"100. Anita, la gorda lagartona, no traga la droga latina 
#JuegoDePalabrasDiario
#PalíndromoMásÉpicoJamásCreado"	non-sexist
929	MeTwo	Twitter	es	Como toda buena aventura, ha empezado en una taberna, pero esta vez mis jugadores le prendieron fuego a la cocina y casi matan a la tabernera. #DungeonsAndDragons #Rol	non-sexist
930	MeTwo	Twitter	es	Ah po déjame ponerme a fregar. https://t.co/zVCLwOE5HI	non-sexist
931	MeTwo	Twitter	es	@CintiaVi1980 @OPINEMOSHOY Es un marimacho. Asi quieren verse	non-sexist
932	MeTwo	Twitter	es	@GDiputado La versión macho, xq la marimacho ya la vimos en Gt antes	non-sexist
933	MeTwo	Twitter	es	@DeluxeSabado Que vergüenza ,un hombre como un castillo dando chance a una niñata que está más sumbada que una maraca y con esa voz tan desagradable ,esos ojos que no ve nada ,por favor Carlos se un hombre y aprende que quien nos niños se acuesta meado se levanta ,que se quede en Peru	non-sexist
934	MeTwo	Twitter	es	Déjate los gatos niñata.	non-sexist
935	MeTwo	Twitter	es	@juan_ancap @RealFranD @Argu_Lucas @carmueller @jdoedoe101101 Y ahora simboliza a cualquiera que no sea progre, según las feministas ajajaja	non-sexist
936	MeTwo	Twitter	es	Zarpado sida me da la hipocresía de las feministas dios	sexist
937	MeTwo	Twitter	es	@ayMeliina Andas en tus días o porq andas más odiosa que de costumbre? Jajajjaja	sexist
938	MeTwo	Twitter	es	@VaronesUnidos Biologia se llama eso..haganle saber a la bolude esta..obvio que si te violan te vas a quedar embarazada si estas en tus dias fertiles	non-sexist
939	MeTwo	Twitter	es	"@Shaquista98 @nhoaa24 Dile : la única zorra aquí eres tu Imbècil.

Y le das un besi en la frente pa que pierda"	sexist
940	MeTwo	Twitter	es	¿Alguien ha pensado que tal vez Anna Todd tiene una relación súper tóxica con su marido y esa es la razón por la que cree un romance tan radioactivo como el Hardin y Tessa es amor verdadero? Digo, de otra manera no se explica como una mujer adulta puede escribir libros así.	non-sexist
941	MeTwo	Twitter	es	@CHVNoticias Pueden subir la entrevista del flaite que abandonó a su hija? Quedé impactado... Como una mujer puede tener hijos con weones así	non-sexist
942	MeTwo	Twitter	es	@pabloalboran Creo que aún no soy capaz de darme cuenta de lo que acabo de vivir. He visto a mi familia unida y emocionarse después de mucho tiempo. He llorado como una niña con mi canción favorita de amor y es todo gracias a ti. Gracias por hacerme feliz💙 https://t.co/3Nxi2Uo5Fa	non-sexist
943	MeTwo	Twitter	es	Soy como una niña, me emociono con cualquier detalle, me molesto sin razón o por capricho...	non-sexist
944	MeTwo	Twitter	es	@Rodr11k @joseyuri10 @DiarioOle Uuhh mira qien apareció, la novia de Fressi.. jajajaj con esa cara de puta loca a quien qeres decirle boludito?? No te maqilles la cara qe pareces una puta de cabaret	sexist
945	MeTwo	Twitter	es	Pareces una puta bolsa con agua, no te queda lo mamona... 😒	non-sexist
946	MeTwo	Twitter	es	"Más no basta un apellido... para ser mujer leal!! 😌

Me echo un palmazo con el? 😎 https://t.co/1CE2Xgm6m4"	non-sexist
947	MeTwo	Twitter	es	"Mucho corazoncito verde, mucho feminismo, pero bardeas a las mujeres q suben foto de pancita??

Ah claro, sale uno a refutarte y en lugar de entablar un debate o discusion, bloqueas.

Fabuloso Malena, fa-bu-lo-so.

Hipócrita. https://t.co/cPSN4nUu4e"	sexist
948	MeTwo	Twitter	es	"No, en todos los casos nos pasaron a fregar, pero aman vivir sometidos.

Nunca abandonaremos ésa mentalidad colonial? Insisto México el caso más grave de síndrome de Estocolmo. https://t.co/JHRgvJp3NK"	non-sexist
949	MeTwo	Twitter	es	@PotiPotiInLove Fijo que su madre también era de las que se ponían a fregar el suelo cuando a ellas les daba la gana sin preguntar ni nada y luego ni te dejaban pasar hasta que no estuviera seco. Era la jefa claramente.	non-sexist
950	MeTwo	Twitter	es	@carmencicuta @Iennicet Otra cosa no será, pero Jenny os pega unas 500mil vueltas currando a la mayoría de las feministas New age que no han pegado palo al agua en su vida. Anda que no la podías haber cagado más.	sexist
951	MeTwo	Twitter	es	"CÓMO UNA MUJER CON
ASPECTO ROMO PUEDE
LLEGAR A VIVIR CON UN
RICO SINO PORQUE ES UN
ASOCIAL

Que no tiene filo ni punta
Sinónimos: boto, mocho, obtuso"	non-sexist
952	MeTwo	Twitter	es	La loca del ETS digo bts. https://t.co/rryjHbigDI	non-sexist
953	MeTwo	Twitter	es	Hola Doc, te cuento que comencé a tener relaciones hace poco tiempo pero ya termine con ese chico... estoy saliendo con otra pe... — Mijaaaaaa, no seas mojigata chica... Que te importa que sea promiscuo... Ponle condon y listo...y... https://t.co/Dg3DbzYbZV	non-sexist
954	MeTwo	Twitter	es	"Hasta el coño de ver a gente en insta quejándose de ""mucho feminismo pero no os quejáis de entrar gratis a las discotecas"" mira de verdad que nos llevamos quejando mucho tiempo ya, unfollow para ti por gilipollas"	sexist
