	dataset	source	language	text	task1
2453	MeTwo	Twitter	es	@jmcacuariano @CarlosAlevito @Bernat_Castro @cakealatake La misma nenaza si ese ejejeje	sexist
2454	MeTwo	Twitter	es	@paco_ritas Hahahaha así es, hablaré con él muy seriamente porque eso de dejarlo como que no, cualquier lagartona me lo puede bajar	non-sexist
2455	MeTwo	Twitter	es	@kalindama Si ella esta por voluntad propia no eres nadie para decidir lo que debe hacer y lo que no, no infantilices a las mujeres, FEMINAZI	sexist
2456	MeTwo	Twitter	es	@celesmonaco Terriblemente obvia se me cae el papel se superpoderosa superada marimacho y quedó re expuesta	non-sexist
2457	MeTwo	Twitter	es	“¿Soy marimacho por jugar al rugby?”. Estas jugadoras tienen la respuesta. https://t.co/s7YJnRqceE	non-sexist
2458	MeTwo	Twitter	es	@Jruiztaco @aurahghvip @suso @FueraMiriam Muy educada la niñata	non-sexist
2459	MeTwo	Twitter	es	@hppxn Mujer tenías que ser para tomarte en serio una joda, lpm	sexist
2460	MeTwo	Twitter	es	"#SomosLaAudiencia6N

Que dice la sobrina de Garo que decimos barbaridades, y las que dice tu tio????? Es que yo flipo. Ha llamado zorra, vete a las esquinas, bajunas.. de verdad que mierda de sociedad"	sexist
2461	MeTwo	Twitter	es	@EnBuenaOndaW @RadioWera @WRADIOMexico Excelente su labor como una mujer mexicana ejemplo de tenacidad y liderazgo en @PorMexicoF #Veracruz necesita más gente así querida paisana	non-sexist
2462	MeTwo	Twitter	es	Mi gata le va a llorar a mi vieja como una niña chiquita, es re dramática basta	non-sexist
2463	MeTwo	Twitter	es	@acrossamaia pareces una puta diosa.	non-sexist
2464	MeTwo	Twitter	es	@MekKaGeoXx A mi me pareces una puta mierda tu	non-sexist
2465	MeTwo	Twitter	es	tío AJJAJAJAJAJJAJAJAJAJAJAJJAJA que pensaba que era la única loca del coño que hacía esto con 7 años wtffffffff https://t.co/qsFhVewCqM	non-sexist
2466	MeTwo	Twitter	es	@INDIGNADlTA95 No valdrías para ser chica Femen.	non-sexist
2467	MeTwo	Twitter	es	"Según la sociedad para ser chica top likeada por todos tenes que tener buen cuerpo, hechas las uñas, maquillarse a diario, vestirte a la moda(seguro super incomodo),tener alto cuerpo pero poner q sos fea,ir al gim, y demás.
Déjenme siendo groncha y con 5 likes. Soy mas feliz así"	non-sexist
2468	MeTwo	Twitter	es	mucha deconstrucción mucho feminismo pero seguís culpandote por algo que te hizo un varón y para nada fue tu culpa amiga *se dice a si misma*	non-sexist
2469	MeTwo	Twitter	es	"Te invitamos a leer nuestra sección de #Revista Mujer al volante, la historia de Judith Vega
https://t.co/DbYd5RZAuz"	non-sexist
2470	MeTwo	Twitter	es	@IvacIsmael El fetichismo es una parafilia. o sea, implicaría darle la razón a los musulmanes, las mujeres no deberían de mostrar nada por encima de los tobillos. No creo que estés de acuerdo con eso Ismael 😂😂😂	sexist
2471	MeTwo	Twitter	es	"@balkraix Hoy en día tienen los mismos derechos que los hombres y aún así los hombres dominan todas las areas.
Gente como vos me confirma que las mujeres no deberian votar."	sexist
2472	MeTwo	Twitter	es	Las Mujeres de hoy en día salen embarazadas a temprana edad y nama le hacen dos meses a lo carajito pa volver a salir a desacatarse ☹️	sexist
2473	MeTwo	Twitter	es	Ya llevo soltero mucho tiempo :c pero las mujeres de hoy en día solo quieren sexo y yo una relación estable :c	sexist
2474	MeTwo	Twitter	es	"Te escapaste, no pudimos llenar los nombres
— Lagartona — preguntale a jero si las pusimos JAJAJA https://t.co/J28vP7ISnn"	non-sexist
2475	MeTwo	Twitter	es	@jimedylan Niñxs???? es acaso alguna forma nueva de bacterias? Pero si te refieres a niños, Obama lo vino haciendo desde 2014, pero como solo te enteras ahora puedo relegar tu tuit como berrinche de feminazi	sexist
2476	MeTwo	Twitter	es	Caminé desde el balcón a la cocina y cuando volví se había hecho de noche.	non-sexist
2477	MeTwo	Twitter	es	Yo con mi batamanta cuando me levanto del sofá y voy a la cocina por agua. https://t.co/uXtcWZMnV4	non-sexist
2478	MeTwo	Twitter	es	Bueno voy a hacer algo, me levantaré a dejar el plato de la cena a la cocina, me tomaré un ibuprofeno, me fumaré un cigarro y me pondré a estudiar.	non-sexist
2479	MeTwo	Twitter	es	‘Gorila, marimacho’: cuatro años acosado por ocho adolescentes https://t.co/TwXSMkjO6H	non-sexist
2480	MeTwo	Twitter	es	@ales_quesada 2 personas lloran y 1 es una niñata y la otra da pena pues igual tiene que ver la diferencia la verdad,,	sexist
2481	MeTwo	Twitter	es	“mujer tenías que ser”. ya te gustaría a tí follar con una, cara mierda.	sexist
2482	MeTwo	Twitter	es	"@guisodemondongo ""A dónde querés ir, pelotudo! Ah! Mujer tenías que ser""

*pañoleta verde ya te siento*"	sexist
2483	MeTwo	Twitter	es	Alguien dígale a las feministas TERF que yo SO LI TA desaparecí a un hombre de la faz del planeta y añadí a una mujer. ¿Que mas radical que eso?	non-sexist
2484	MeTwo	Twitter	es	La perra de la Cardi B me cae mal pero como me gustan unas dos que tres canciones de esa zorra	sexist
2485	MeTwo	Twitter	es	@midoblas_ Hola Mimi soy Juan,mira lo primero de todo decirte,que eres una mujer guapa,preciosa,bonita,mona y hermosa,buena cantante,me parece bien que como una mujer que eres estupenda,que te queda genial tu coleta,sobre todo es muy larga y tienes mucho pelo muy rubia,muy bonit	non-sexist
2486	MeTwo	Twitter	es	Mañana empiezo mis clases de Inglés. Hace tantos años que no tengo clases presenciales que estoy ilusionada como una niña pequeña. https://t.co/Q125kL9Cln	non-sexist
2487	MeTwo	Twitter	es	"""Pareces una puta con ese piercing ahi"" lo que me dice mi hermanito de 9 años"	sexist
2488	MeTwo	Twitter	es	@madbauhaus 😂😂😂😂 los mejores el primero “la patada voladora” y el último la loca del poste 😂😂😂	non-sexist
2489	MeTwo	Twitter	es	"@CarlosVerareal @GaloLaraYepez Esta noticia me tiene ASQUEADO.
VOMITO por los beneficios d ese perro borrego.
Q los presos d las demás cárceles hagan huelga d hambre hasta q les igualen los beneficios q tiene ese perro segundón d mafia trucha d la loca del ático.
Q conoce esta bestia d los actuales q le temen?"	non-sexist
2490	MeTwo	Twitter	es	Igual mis razones para pensarlo son de tía loca del pussy pero DA IGUAL.	non-sexist
2491	MeTwo	Twitter	es	Que bochorno y q decepción para aquellos q votaron por ella y a quienes ya no representa, para ser mujer q se dice luchadora no le da ni calza los zapatos de @MariaCorinaYA https://t.co/fnH9mmT36k	non-sexist
2492	MeTwo	Twitter	es	... no sabía que me seguía tanta mojigata	non-sexist
2493	MeTwo	Twitter	es	Normalizen la amistad entre el hombre y la mujer lpm mucho feminismo pero no empezas por lo principal	sexist
2494	MeTwo	Twitter	es	@Irene_Montero_ @ahorapodemos Si si mucho feminismo, pero te acuestas con uno que según sus palabras te azotará hasta que sangres. Doble moral.	non-sexist
2495	MeTwo	Twitter	es	@Iam_lela07 Jajaja yo voltear las curvas 😂🙊 mujer al volante peligro constante ,igual voy sacar mi licencia cómo sea pero de que saco la saco ehhj	sexist
2496	MeTwo	Twitter	es	La participación femenina en la representatividad política electa en EEUU demuestra que la paridad no es una cuestión de cuotas sino de preparación y acceso a las oportunidades. Las mujeres no deberían ser líderes porque son mayoría sino porque están mejor cualificadas...	non-sexist
2497	MeTwo	Twitter	es	@AdamWolf_US No te deja en ninguna posición. Ni soy un niño ni me has devorado. Con toda sinceridad, el drama contigo no viene sólo porque seas un hombre lobo, si no, no me llamaría mariquita y nenaza	sexist
2498	MeTwo	Twitter	es	No seas nenaza, es parte de un desayuno equilibrado. La cerveza está de puta madre con cochokris.... chocoriz... choco--- los cereales que Bored tiene en la balda de abajo porque arriba no alcanza. Ya verás, ya verás. Gihee.	sexist
2499	MeTwo	Twitter	es	"Anita, la gorda lagartona, no traga la droga latina...

Ahora leelo al revés..."	non-sexist
2500	MeTwo	Twitter	es	@NeoMShadows @ITRnoticias1 @juancarlosvrm Dire algo asi como hay hombres malos desgraciados tambien hay mujeres ojala no se haya topado con una lagartona vengativa	non-sexist
2501	MeTwo	Twitter	es	Me ha gustado un vídeo de @YouTube (https://t.co/X3cuPIqugC - Hillkin - Feminazi).	non-sexist
2502	MeTwo	Twitter	es	"Koalita tenía a su amiga Míriam ayudándole en el tema de las comidas cuando decidieron ambos separarse de la cocina del Sr. Garó.
¿Y ahora qué?
¿Quién les va a cocinar a todos?
Míriam no es rencorosa y se prestará a volver a la cocina con la ayuda de Koala 💪🏻
#SomosLaAudiencia8 https://t.co/fsCTPOOSRy"	non-sexist
2503	MeTwo	Twitter	es	@vaso_con_leche @BTS_twt Pues... Lo que yo hago, es pararme con mi cuaderno en un lugar lejano a la cocina :v entonces, cada vez que me aprendo algo, voy avanzando un paso hasta llegar a la cocina y comer xD	non-sexist
2504	MeTwo	Twitter	es	@NoticiasCaracol Pero como desafortunadamente nuestra constitución súper garantista del 91 la hicieron los máximos delincuentes de colombia (los congresistas) no hay nada que hacer, hasta que no modifiquemos nuestras leyes en contra de la reincidencia nos vamos a fregar	non-sexist
2505	MeTwo	Twitter	es	@tanolamente007 @Santi_ABASCAL Este marimacho tiene que decir lo que la dicen,  porque sino la calientan,  y es una desgraciada porque no sabe de fenderse	non-sexist
2506	MeTwo	Twitter	es	@jossenarvaez jose calma  atu .marimacho dina jaja	non-sexist
2507	MeTwo	Twitter	es	@ghoficial Que no dejes que esa niñata acostumbrada a salirse siempre con la suya te hunda arrak ella no quiere reconocer que paso porque quedaría fatal	non-sexist
2508	MeTwo	Twitter	es	"@BlackWings_00 @mafixpiol4li Por que una ""mujer trans"" que con solo decir ""mujer"" ya estoy asumiendo su genero, pero bueno, cuando va al shoping lo primero q busca es la faldita mas corta, los tacos mas grandes, el maquillaje mas fino, en fin estereotipo femenino q a las feministas no clasica... no entiendo"	non-sexist
2509	MeTwo	Twitter	es	Nuestra #LíneaEdiciónEspecial está diseñada para fortalecer tu cabello y aportar fragancia en tus días más especiales.	non-sexist
2510	MeTwo	Twitter	es	Quiero estar con vos. No un rato, no un día. Quiero estar con vos en tus días buenos y también en los peores. Estar con vos, así de simple.	non-sexist
2511	MeTwo	Twitter	es	Eh sacado un video! por fin revele mi fea voz jajaja estoy nerviosa y temblando como una niña. Pero lo reitero las criticas son para crecer!	non-sexist
2512	MeTwo	Twitter	es	@SandyFlores7_7 No le hagas caso a los lameculos aqui, si pareces una puta, y si lo eres,  excelente, tu has lo que quieras. Para mi, que parezcas puta es lo deseable.	sexist
2513	MeTwo	Twitter	es	quien tuvo la idea de hacer esto la loca del bebito https://t.co/Y2IHt5GCoN	non-sexist
2514	MeTwo	Twitter	es	Mamá de estar loca del coño.	non-sexist
2515	MeTwo	Twitter	es	"—¿Por qué no te guardaste el dinero para comprarlas en otra tienda si no te gustaban? —preguntó un tanto confundido para tomar una y comerla, lo cierto es que estaban ""bien"" a secas.

—Así que... eres hija única. Eres bastante alta para ser chica, me &gt;"	sexist
2516	MeTwo	Twitter	es	@AleTrevino95 Ay no mames!!!! No seas pinche mojigata!!	non-sexist
2517	MeTwo	Twitter	es	@Milenio mujer al volante peligro constante, a quien se le ocurre poner tras el volante a una vieja.	sexist
2518	MeTwo	Twitter	es	Soy mujer y creo que las mujeres no deberian opinar de deportes en los noticieros 😂	sexist
2519	MeTwo	Twitter	es	"@szczurivo No se, para mi es una cuestión moral, conozco a banda de gente de esa edad y a ninguno de ellos los escuche decir ""a las mujeres hay que voltearselas"", entre otras cosas"	sexist
2520	MeTwo	Twitter	es	Odio a las mujeres la puta madre	sexist
2521	MeTwo	Twitter	es	@CriticoJM @RubenSanchezTW Más bien eres una nenaza, @RubenSanchezTW	sexist
2522	MeTwo	Twitter	es	@valtonyc Eres una nenaza de mierda!!!encima mongolo del todo...imbécil.	sexist
2523	MeTwo	Twitter	es	@pctterI Nope. Tal vez deberías venir a la cocina y decírmelo.	non-sexist
2524	MeTwo	Twitter	es	@sextaNoticias Eso, eso. Que se ponga él a fregar o a levantar enfermos a los 75 años, pedazo de sinvergüenza	non-sexist
2525	MeTwo	Twitter	es	"Carmen va a un instituto en el que llevan uniforme. Las niñas pueden llevar falda o pantalón. La única que lleva pantalón es mi hija. Hoy una compañera le ha dicho que ""pareces una marimacho"". Niñas con 12-13 años con esa mentalidad. Estamos haciendo algo muy, muy mal"	non-sexist
2526	MeTwo	Twitter	es	"Quienes me saludan, soy Arabelle.~ Un placer conocerles.

Y tú, enano, nada de llamarme niñata. Más te gustaría que esta niñata te comiese todo."	non-sexist
2527	MeTwo	Twitter	es	@jjaviervazquez fatal el trato.a techi x defender a esa mentirosa d niñata d pantoja,q https://t.co/u5jlj5GyVM xq la meteis en.ese programa,es una mentirosa y una cara dura	non-sexist
2528	MeTwo	Twitter	es	¡Que le pregunten a Mayte Martín! Hay que joderse con la niñata pija. Le ha faltado decir que es judía, de un CDR y que el estado le persigue. Vete a gastar otro milloncejo de euros en publicidad, anda. https://t.co/nwXGfB1IPH	non-sexist
2529	MeTwo	Twitter	es	@AlfredSanz @leaa_pedone @magalitajes No entiendo q te quejas de los argumentos, si tu ídolo Agustín Laje tambien se refiere a las feministas cómo “feminazis”. Ese es su argumento para defender una ideología que el no comporte! De la misma manera le responde Magali diciéndole cara de ...	sexist
2530	MeTwo	Twitter	es	LA PÁGINA DEL BANCO BOD ES LA VAINA MAS ZORRA DEL UNIVERSO. QUE MIERDAAAAAAA	non-sexist
2531	MeTwo	Twitter	es	Como una mujer con grandes cualidades y una trabajadora leal y comprometida, es recordada Madeleine https://t.co/S0Yw5maNk5	non-sexist
2532	MeTwo	Twitter	es	Momento nefasto para ser mujer en Tucumán.	non-sexist
2533	MeTwo	Twitter	es	"@isidrocorro Se cumplió el adagio en este caso en particular:
""Mujer al volante, peligro constante""..."	sexist
2534	MeTwo	Twitter	es	"@el_pais Entonces de aquello de ""mujer al volante, peligro constante"" ya ni hablamos ¿no? https://t.co/8RhzYjtiFW"	sexist
2535	MeTwo	Twitter	es	Mujer al volante... conducción más segura: las jóvenes de #Cantabria provocan menos accidentes en la carretera que los hombres de su edad https://t.co/dFiixZTLo6	non-sexist
2536	MeTwo	Twitter	es	"Mujer al volante, peligro constante... ya no se diga si le dejas un tráiler. <f0><U+009F><U+0098><U+00B1>

Obvio, es broma, hemos visto varios ejemplos similares de traileros varones, y este es uno más de esas desgracias. https://t.co/vHmzKgUeXG"	sexist
2537	MeTwo	Twitter	es	@LaurenJauregui Jodidamente sexy una mujer al volante <f0><U+009F><U+00A4><U+0098><f0><U+009F><U+0098><U+008D><f0><U+009F><U+0092><U+009C><f0><U+009F><U+0087><U+00B2><f0><U+009F><U+0087><U+00BD>	non-sexist
2538	MeTwo	Twitter	es	"@LekaconK @relascopio Soy mujer, Y NO ESTOY OPRIMIDA, NO SOY UNA VÍCTIMA!! DEJAD DE TRATARME COMO UNA VÍCTIMA QUE NECESITA SOBREPROTECIÓN!! REPITO: 
NO ESTOY OPRIMIDA POR NADIE, NUNCA LO HE ESTADO. 
Enserio, las mujeres de hoy en día deberían replantearse cuales son esas ""opresiones"" de las que hablan"	non-sexist
2539	MeTwo	Twitter	es	"M: Ay pero con lo lagartona que es Noelia , por favor 
Yo: Como como , porque lagartona ? 
M: Deay hpta vos no te le dejas a nadie sin importar nada 
Yo: Ay Maria que mentirosa 
M: A usted no le pueden decir “ A “ porque ya haces un desmadre"	non-sexist
2540	MeTwo	Twitter	es	El segundo lagarto mas grande del planeta es el cocodrilo de agua salada, el primero es la lagartona que intenta ligarles a mi crush https://t.co/KNHnXmmRuA	sexist
2541	MeTwo	Twitter	es	"Le preguntaron a cada ""feminazi"" su partidismo político... <f0><U+009F><U+0098><U+0091> https://t.co/YNWWzWdApb"	sexist
2542	MeTwo	Twitter	es	Fui a buscar algo de tomar a la cocina y me fui de gta por las escaleras jshajajaja:(((	non-sexist
2543	MeTwo	Twitter	es	@linyubeh @LosAngeles_ok Lo hizo jaaaa y quedó vomitando veneno la marimacho	non-sexist
2544	MeTwo	Twitter	es	@Reddxdxragxn @xLadyTrickster A ver, déjame explicarte algo, que yo sea mujer y mentalmente sea masculina, es decir, una marimacho, no me otorga una identidad sexual diferente, solamente soy una mujer que es un poco más masculina que el resto, pero ya está.	non-sexist
2545	MeTwo	Twitter	es	@rood_raul Que niñata mas insoportable!!!!	non-sexist
2546	MeTwo	Twitter	es	@Loreniita_30 Niñata	non-sexist
2547	MeTwo	Twitter	es	Cada dia aguanto menos a Rosalia vaya niñata chiquillo	non-sexist
2548	MeTwo	Twitter	es	@DeluxeSabado #SomosLaAudiencia11N Belén Rodríguez: Yo no me e sentido en ningún momento ofendida x Ángel, mmm vale, entonces, si te llamarán zorra, chusma, bajuna etc todos los días no pasaría nada no?	non-sexist
2549	MeTwo	Twitter	es	@MaracuchaOriana como una mujer que trabaja con dolares puede estar pidiendo saldo?	non-sexist
2550	MeTwo	Twitter	es	"@MercheOficial Hoy nos vemos y la vamos a liar parda y lo sabes<f0><U+009F><U+0098><U+008D><f0><U+009F><U+0098><U+008D>
Ganas de ti, de tu directo y disfrutar como una niña chica<f0><U+009F><U+0098><U+008E><f0><U+009F><U+0098><U+008E>
¡Eres magia!<U+2764> #DeOtraManera #TourDeOtraManeraPalmaDelRio #TeLoMerecesRemix #EllasSi https://t.co/eNu7fR6Z9w"	non-sexist
2551	MeTwo	Twitter	es	#SomosLaAudiencia10 ésta se cree que como es sábado y hacen el deluxe la van a sacar en directo haciendo ése monólogo de loca del coño!!que asco de mujer y con esas pintas!!	non-sexist
2552	MeTwo	Twitter	es	"La final más loca del mundo.
https://t.co/V1eEz6BYa6"	non-sexist
2553	MeTwo	Twitter	es	No se nada de la loca del vaso ni me interesa. Basta	non-sexist
2554	MeTwo	Twitter	es	@CNNChile @tv_monica Nunca  tanto , no en un buen actor,su cualidad es que es trans , ese es su género , por lo tanto tiene un género,pero sí un trans que quiere ser mujer y tiene los medios se puede operar y quitarse el pene para ser mujer está bien,pero si no se quiere quitar por algo será ,lógico	non-sexist
2555	MeTwo	Twitter	es	A la mierda, seré chico bc no valgo para ser chica.	non-sexist
2556	MeTwo	Twitter	es	No nací para ser chica fit	non-sexist
2557	MeTwo	Twitter	es	Borracha pero no mojigata. Bye<f0><U+009F><U+0098><U+0098>	non-sexist
2558	MeTwo	Twitter	es	No es lo bandida lo que molesta, amigos. ¡Es lo doble moral y mojigata!	non-sexist
2559	MeTwo	Twitter	es	#primerplano creo que el problema es la sra. Maldonado se sintió traicionada por Salosny. Y la Sra. Patricia sera pinochetista y todo pero la sra. es de una solo linea. y la Salosny es bien cínica y mojigata es como donde calienta el sol!	non-sexist
2560	MeTwo	Twitter	es	ES QUE AQUI MUCHO FEMINISMO PERO LOS CONDONES QUE SE LOS PONGA EL TIO NO TE JODE! PONTE TU UN ARO AL CARAJO	sexist
2561	MeTwo	Twitter	es	Mucho feminismo pero cuando pensas diferente te atacan, mm esa sororidad	sexist
2562	MeTwo	Twitter	es	A las mujeres hay que quererlas, amarlas, comprenderlas, consentirlas, traerlas aquí... hacerlo por el placer del amor que les tienes y no por obligación.	non-sexist
2563	MeTwo	Twitter	es	Odio a las mujeres que saludan con beso, like, my fucking makeup estúpida!	non-sexist
2564	MeTwo	Twitter	es	@uterope Esta señora parece salida de la Santa Inquisición. Pobres coj...s los seguidores de esta lagartona, que vive del diezmo	non-sexist
2565	MeTwo	Twitter	es	Qué perro oso con la gente que dice “feminazi”	non-sexist
2566	MeTwo	Twitter	es	@lisanlabanca Atajandose de las feminazi q te linchan por todo	sexist
2567	MeTwo	Twitter	es	@Madmax16075757 @catmyrfree @Mr_morq @isabeldangueira @DonTenori14 @Christi36833350 @massaborrega @56Lucas5 @tap_super @Ororo_Pride @silvia_yucca @Aurantiacum @Dan__Vader @Cebacega4 @escofet_jaume @cositasmartinez @Peio_Basque @Jrgen27307674 @ValeriaAlfaya @Morafanova @FreeyellowMarta @santsfree @Donpinpon2011 @ultrasRoures @AdrianBlanco6 @homo_politik @LaVidaNoEsFtbo1 @jlinares63 @CanLaika @Juanma_Saez @Xerxiodpo @UribeX @ZulO_eSp @Dzonrensen @77populacho @Sargantania1 @seingantistenes @DavMatMe @crmontoro @quicowinehouse @davidzelt @CebaCega2 @GloriaFontLopez @moscojonera49 @martinalliue80 @aitor_tillas_ @hedonitt01 @Alekrinora @Luismita Entonces lo de marimacho sobra. Yo en cambio si tengo ganas de conocerla. Me parece una mezcla entre alguien culto e irónico a la vez y estoy segura que tiene que ser muy divertida	non-sexist
2568	MeTwo	Twitter	es	@Vignista211 @laufer4 @MicaViciconte @AngeldebritoOk Son 2 Resentidas con pinta de Gatos! Eso son Todos????  Florcita demostro ser Mosquita Muerta y la Marimacho Peleadora sin Talento ni hablar!!!	non-sexist
2569	MeTwo	Twitter	es	Hombre es que en los entrenamientos te comportabas como una niñata gilipollas.	non-sexist
2570	MeTwo	Twitter	es	@h0lypachuka Me cago en toda tu desgracia ni me has dado el like del respeto niñata	non-sexist
2571	MeTwo	Twitter	es	Oh wow las feministas pueden ser miopes como el 80% de la poblacion im shaking que atrevidas locas. https://t.co/k2udVePNNa	non-sexist
2572	MeTwo	Twitter	es	Sabes que estás en tus días cuando no has caminado casi absolutamente nada, pero las piernas te duelen como si hubieras corrido un maratón ...	non-sexist
2573	MeTwo	Twitter	es	@EstebanMarchand Bajo esa concepción la mujer peruana tendría que vestirse como una mujer musulmana, el problema no es vestimenta, son los valores que se enseñan en casa.	non-sexist
2574	MeTwo	Twitter	es	"Si la vida te golpea y te tira al suelo,levántate,sacúdete y dile ""Golpeas como una niña"" <f0><U+009F><U+0091><U+008C><f0><U+009F><U+0092><U+00AA> https://t.co/93NjZ9LLl1"	sexist
2575	MeTwo	Twitter	es	"Somos mujeres libres, dejá de preocuparte por tu vestimenta, una pollera no es ""mucho"", un top no te define. 
""Pareces una puta con eso"" NO, basta. Dejemos de escuchar la crítica de los necios y vivamos más."	sexist
2576	MeTwo	Twitter	es	Y yo he empezado a pensar en todo lo que me ha pasado a lo largo de la vida. Y Dios menuda vida más intensita para ser mujer blanca occidental de clase media baja xdddd	non-sexist
2577	MeTwo	Twitter	es	@caroagi @anikave @GasparRivas @tv_monica Sorry, sin ánimo de polemizar, hay requisitos para ser mujer? Cuales?	non-sexist
2578	MeTwo	Twitter	es	@AlexMurilio Maluma va q vuela para ser chica trans... Paso de ser el chacal de la colonia a ser dama de noche aaaaaaaush	non-sexist
2579	MeTwo	Twitter	es	#SomosLaAudiencia11 #SomosLaAudiencia11N #ghvipdbt9 La Barneda es la típica mojigata que va de rebelde en un carisisimo colegio de monjas	non-sexist
2580	MeTwo	Twitter	es	@Parejaperfectaz @stones_natalia @staffdeactrices Que buenooo cariñooo ,siempre a las mujeres hay que tratarlas bien	non-sexist
2581	MeTwo	Twitter	es	"#EnBluJeans
A las mujeres hay que aprenderles la terapia de la quejadera.
Eso es lo que las hace vivir más que los hombres. @LUISCARLOSRUEDA @HernandezSimon @Mayerlingveloza @DayanyCorredor https://t.co/Tjs6yttIsV"	sexist
2582	MeTwo	Twitter	es	"@DeluxeSabado Que verguenza!
Arcaica, desde luego no perteneces a las mujeres de hoy en dia!"	non-sexist
2583	MeTwo	Twitter	es	Vamos, ya la hago yo —responde tirando del brazo de la chica para llevarla a la cocina—. Tenías que ganarte mi amistad y en vez de eso, me pones a cocinar para ti. https://t.co/LbnXXLdA9L	non-sexist
2584	MeTwo	Twitter	es	"<U+261D>Hermosas las sartenes de granito de @maestrodecocina_ conseguilas en nuestra tienda online<f0><U+009F><U+008D><U+00B3> https://t.co/1gzpUVYbt2
#lunes<f0><U+009F><U+0092><U+00AA> #comidacasera #amococinar https://t.co/MYuiZuNUTQ"	non-sexist
2585	MeTwo	Twitter	es	X alguna razón entre a la cocina y vi en la tele a pata Villanueva, así de golpe, Sin aviso.	non-sexist
2586	MeTwo	Twitter	es	Pobres esas madres que se han desvivido y ahora su hijo no se digna ni a fregar los platos	non-sexist
2587	MeTwo	Twitter	es	@infinitylau Ajajajaj justo ella q es como un marimacho va a decir q Laura es fea?<f0><U+009F><U+0098><U+0082><f0><U+009F><U+0098><U+0082>ya es mucho el papelón q hace ma vicha, Laura es bellísima<f0><U+009F><U+0092><U+0096>	non-sexist
2588	MeTwo	Twitter	es	"siempre me jodieron bastante por esto ""Como podes tener amigos varones, si sos una nena"" ""ellos te ven con otros ojos, tene cuidado"" ""sos una marimacho"" ""te tenes que juntar con nenas"""	sexist
2589	MeTwo	Twitter	es	Que gestos de superioridad por dios.... como me gustaría que su ira se le fuese de las manos e hiciese algo q ya no se pudiera justificar con el vacío inicial de la casa, q es con lo q se justifica todas las actitudes de la niñata esta, y se cargase solita su concurso #GHVIP12N	non-sexist
2590	MeTwo	Twitter	es	MARTA ALBA Y JULIA DICIENDO MARCAS SIN PARAR.... A ELLAS NO LES LINCHAIS?? SOLO LA NIÑATA MALCRIADA ES MARIA?? VENGA HOMBRE #OTDirecto12NOV	non-sexist
2591	MeTwo	Twitter	es	@MaritereBraschi  Mujer tenias que ser ! ... Las mujeres tenemos mas caràcter para decir las verdades y enfrentarlas ! Bien dicho !  Bravo ! <U+2665><U+FE0F>	non-sexist
2592	MeTwo	Twitter	es	Es lo peor salir de tu casa en tus días, te entiendo https://t.co/NFPWfJn74h	non-sexist
2593	MeTwo	Twitter	es	Quédense cerca de las personas que te dieron luz en tus días más oscuros	non-sexist
2594	MeTwo	Twitter	es	cómo voy a dormir sabiendo q no me he enterao de una mierda de los textos de administración y si mañana me pregunta no voy a tener ni zorra https://t.co/wxP5VTQBod	non-sexist
2595	MeTwo	Twitter	es	@Chileokulto @RocoPamela Puta que impotencia..y si tu te defiendes y los agredes..la zorra te keda....pero ellos de temporada de playa y short te pescan la pierna y pal lado con ella..puta estos ctm..todos los dias el abuso de.poder...pero mandalos pa la legua...se le aconchan	non-sexist
2596	MeTwo	Twitter	es	"Quiero saber.

Ni zorra, perra o gata se valen okay. https://t.co/gvNCGoXGJB"	non-sexist
2597	MeTwo	Twitter	es	@karenmelanydiaz Gorda mi poronga pedaso de zorra	sexist
2598	MeTwo	Twitter	es	Nada como una mujer todo terreno.	non-sexist
